{
  "schemaVersion": 2,
  "id": "webgpu-shadow-pipeline-integration",
  "title": "WebGPU Cached Shadow Pipeline Integration",
  "skill": "threejs-scalable-real-time-shadows",
  "threeRevision": "0.185.1",
  "kind": "integration-demo",
  "status": "accepted",
  "canonicalSource": [
    "threejs-scalable-real-time-shadows/examples/webgpu-shadow-pipeline-integration/main.js",
    "threejs-scalable-real-time-shadows/examples/webgpu-shadow-pipeline-integration/index.html",
    "threejs-scalable-real-time-shadows/examples/webgpu-cached-clipmap-shadow/canonical-lab.js",
    "threejs-scalable-real-time-shadows/examples/webgpu-cached-clipmap-shadow/cached-clipmap-shadow-node-v2.js"
  ],
  "browserEntry": "threejs-scalable-real-time-shadows/examples/webgpu-shadow-pipeline-integration/index.html",
  "publishPath": "/demos/webgpu-shadow-pipeline-integration/",
  "scenarios": [
    {
      "id": "cached-shadow-image-pipeline",
      "title": "Cached clipmap through one final image pipeline",
      "startup": {
        "scenario": "cached-shadow-image-pipeline",
        "tier": "high",
        "mode": "final"
      },
      "acceptanceStatus": "accepted"
    }
  ],
  "mechanisms": [
    {
      "id": "child-shadow-receiver-blend",
      "route": "/demos/webgpu-shadow-pipeline-integration/?mechanism=child-shadow-receiver-blend",
      "startup": {
        "mode": "final"
      },
      "acceptanceStatus": "accepted"
    },
    {
      "id": "sequential-shadow-updates",
      "route": "/demos/webgpu-shadow-pipeline-integration/?mechanism=sequential-shadow-updates",
      "startup": {
        "mode": "owner-graph"
      },
      "acceptanceStatus": "accepted"
    },
    {
      "id": "single-output-ownership",
      "route": "/demos/webgpu-shadow-pipeline-integration/?mechanism=single-output-ownership",
      "startup": {
        "mode": "owner-graph"
      },
      "acceptanceStatus": "accepted"
    }
  ],
  "tiers": [
    {
      "id": "high",
      "targetClass": "current WebGPU adapter",
      "frameTargetMs": null,
      "resolutionPolicy": {
        "width": 1200,
        "height": 800,
        "dpr": 1
      },
      "mechanismLimits": {
        "cachedShadowTier": "high",
        "receiverTopology": "independent-textures-static-loop-frustum-gated"
      },
      "resourceLimits": {
        "rendererOwners": 1,
        "finalRenderPipelineOwners": 1,
        "toneMapOwners": 1,
        "outputTransformOwners": 1
      },
      "degradationFromPrevious": [],
      "preservedInvariants": [
        "one renderer owner",
        "one final RenderPipeline owner",
        "one tone-map owner",
        "one output-color-transform owner"
      ],
      "acceptanceStatus": "accepted"
    }
  ],
  "modes": [
    "final",
    "shadow-depth",
    "owner-graph"
  ],
  "cameras": [
    "near",
    "design",
    "far"
  ],
  "seeds": [
    1,
    2654435769
  ],
  "capabilityRequirements": [
    {
      "id": "native-webgpu",
      "required": true,
      "evidence": "renderer backend gate after initialization",
      "status": "accepted"
    },
    {
      "id": "comparison-depth-textures",
      "required": true,
      "evidence": "directional shadow map comparison sampling path",
      "status": "accepted"
    }
  ],
  "runtimeProof": [
    {
      "id": "renderer-init",
      "required": true,
      "evidence": "await renderer.init() in canonical browser controller",
      "status": "accepted"
    },
    {
      "id": "backend-is-webgpu",
      "required": true,
      "evidence": "renderer.backend.isWebGPUBackend === true",
      "status": "accepted"
    },
    {
      "id": "mechanism-reachable",
      "required": true,
      "evidence": "integration mechanisms reach shadow and final output ownership graph",
      "status": "accepted"
    },
    {
      "id": "aligned-readback",
      "required": true,
      "evidence": "capturePixels derives integer 256-byte-aligned row stride",
      "status": "accepted"
    },
    {
      "id": "child-shadow-targets-consumed",
      "required": true,
      "evidence": "child cached-clipmap shadow targets consumed by final pipeline",
      "status": "accepted"
    },
    {
      "id": "single-final-output-ownership",
      "required": true,
      "evidence": "renderOutput owns tone map/output transform; RenderPipeline.outputColorTransform=false",
      "status": "accepted"
    },
    {
      "id": "render-or-compute-work",
      "required": true,
      "status": "accepted",
      "evidence": "unified-v2 approved release: correctness capture + CDP Chrome hardware physical-route review + offline visual signoff"
    }
  ],
  "evidenceContract": "v2",
  "evidenceBundle": "docs/visual-validation/webgpu-shadow-pipeline-integration/bundle",
  "validationCommand": "npm --prefix threejs-scalable-real-time-shadows/examples/webgpu-shadow-pipeline-integration run validate:unit",
  "commands": {
    "check": "npm --prefix threejs-scalable-real-time-shadows/examples/webgpu-shadow-pipeline-integration run check",
    "test": "npm --prefix threejs-scalable-real-time-shadows/examples/webgpu-shadow-pipeline-integration run validate:unit",
    "mutations": "npm --prefix threejs-scalable-real-time-shadows/examples/webgpu-shadow-pipeline-integration run test:mutations",
    "capture": "npm --prefix threejs-scalable-real-time-shadows/examples/webgpu-shadow-pipeline-integration run capture",
    "validateArtifacts": "npm --prefix threejs-scalable-real-time-shadows/examples/webgpu-shadow-pipeline-integration run validate:artifacts",
    "validateQuick": "npm --prefix threejs-scalable-real-time-shadows/examples/webgpu-shadow-pipeline-integration run validate:quick",
    "validateFull": "npm --prefix threejs-scalable-real-time-shadows/examples/webgpu-shadow-pipeline-integration run validate:full"
  },
  "sourceHash": null,
  "proxyStatus": null,
  "notes": [
    "The owner graph is implemented, but current-adapter native-WebGPU render-target, timing, resource, and lifecycle evidence is pending."
  ]
}