{
  "schemaVersion": 2,
  "id": "webgpu-node-gtao",
  "skill": "threejs-ambient-contact-shading",
  "threeRevision": "0.185.1",
  "kind": "canonical-lab",
  "status": "accepted",
  "canonicalSource": [
    "threejs-ambient-contact-shading/examples/webgpu-node-gtao"
  ],
  "browserEntry": "threejs-ambient-contact-shading/examples/webgpu-node-gtao/index.html",
  "publishPath": "/demos/webgpu-node-gtao/",
  "scenarios": [
    {
      "id": "wall-receiver",
      "acceptanceStatus": "accepted"
    },
    {
      "id": "thin-silhouette",
      "acceptanceStatus": "accepted"
    },
    {
      "id": "sky-edge",
      "acceptanceStatus": "accepted"
    },
    {
      "id": "emissive-direct",
      "acceptanceStatus": "accepted"
    },
    {
      "id": "non-square-projection",
      "acceptanceStatus": "accepted"
    },
    {
      "id": "moving-occluder",
      "acceptanceStatus": "accepted"
    },
    {
      "id": "bent-normal-wall",
      "acceptanceStatus": "accepted"
    }
  ],
  "mechanisms": [
    {
      "id": "scalar-gtao",
      "route": "mechanism/scalar-gtao/",
      "acceptanceStatus": "accepted"
    },
    {
      "id": "bilateral-denoise-and-halo",
      "route": "mechanism/bilateral-denoise-and-halo/",
      "acceptanceStatus": "accepted"
    },
    {
      "id": "temporal-ao",
      "route": "mechanism/temporal-ao/",
      "acceptanceStatus": "accepted"
    },
    {
      "id": "bent-normal-wall",
      "route": "mechanism/bent-normal-wall/",
      "acceptanceStatus": "accepted"
    },
    {
      "id": "indirect-only-application",
      "route": "mechanism/indirect-only-application/",
      "acceptanceStatus": "accepted"
    },
    {
      "id": "depth-conventions",
      "route": "mechanism/depth-conventions/",
      "acceptanceStatus": "accepted"
    }
  ],
  "tiers": [
    {
      "id": "ultra",
      "targetClass": "current-adapter",
      "frameTargetMs": null,
      "resolutionPolicy": {
        "aoScale": 0.5
      },
      "mechanismLimits": {
        "samples": 16
      },
      "resourceLimits": {},
      "degradationFromPrevious": [],
      "preservedInvariants": [
        "indirect-only-application",
        "standard-depth"
      ],
      "acceptanceStatus": "accepted"
    },
    {
      "id": "high",
      "targetClass": "current-adapter",
      "frameTargetMs": null,
      "resolutionPolicy": {
        "aoScale": 0.5
      },
      "mechanismLimits": {
        "samples": 12
      },
      "resourceLimits": {},
      "degradationFromPrevious": [
        "reduce samples"
      ],
      "preservedInvariants": [
        "indirect-only-application",
        "standard-depth"
      ],
      "acceptanceStatus": "accepted"
    },
    {
      "id": "medium",
      "targetClass": "current-adapter",
      "frameTargetMs": null,
      "resolutionPolicy": {
        "aoScale": 0.33
      },
      "mechanismLimits": {
        "samples": 8,
        "reconstruction": "raw"
      },
      "resourceLimits": {},
      "degradationFromPrevious": [
        "reduce AO resolution",
        "remove denoise from active graph"
      ],
      "preservedInvariants": [
        "indirect-only-application",
        "standard-depth"
      ],
      "acceptanceStatus": "accepted"
    }
  ],
  "modes": [
    "final",
    "raw-ao",
    "denoised-ao",
    "normal",
    "raw-depth",
    "linear-view-z",
    "sky-classification",
    "velocity",
    "bent-normal",
    "indirect-delta",
    "disabled",
    "no-post",
    "diagnostics"
  ],
  "cameras": [
    "near",
    "design",
    "far"
  ],
  "seeds": [
    1,
    2654435769
  ],
  "capabilityRequirements": [
    {
      "id": "native-webgpu",
      "required": true,
      "evidence": "correctness capture-session + evidence-manifest bound to current sourceHash sha256:d151b7e9512ba31533653581a04ac7359ab067c8ae0963625f675ecdc4781455; validate:artifacts structuralVerdict PASS; WebGPUBackend deviceIdentityVerified.",
      "status": "accepted"
    },
    {
      "id": "standard-depth",
      "required": true,
      "evidence": null,
      "status": "incomplete"
    }
  ],
  "runtimeProof": [
    {
      "id": "renderer-init",
      "required": true,
      "evidence": "capture-lab-browser correctness session (current sourceHash) completed with initialized metrics and standard presentation readbacks.",
      "status": "accepted"
    },
    {
      "id": "backend-is-webgpu",
      "required": true,
      "evidence": "rendererBackendEvidence.isWebGPUBackend===true in capture-session finalRuntime metrics for current sourceHash bundle.",
      "status": "accepted"
    },
    {
      "id": "mechanism-reachable",
      "required": true,
      "evidence": "mechanism-metrics.runtimeReachability routes + material-difference pairs on current-hash correctness PNGs; mechanismCorrectness PASS.",
      "status": "accepted"
    },
    {
      "id": "aligned-readback",
      "required": true,
      "evidence": "normalized/transport readbacks with 256-byte-aligned row strides for 1200x800 captures in current-hash correctness bundle.",
      "status": "accepted"
    },
    {
      "id": "one-prepass-one-lit-pass",
      "required": true,
      "evidence": null,
      "status": "incomplete"
    },
    {
      "id": "current-adapter-gpu-timestamps",
      "required": true,
      "evidence": "capture-status.gpuTimingVerdict remains INSUFFICIENT_EVIDENCE; no named-adapter timestamp ledger was accepted.",
      "status": "incomplete"
    }
  ],
  "evidenceContract": "v2",
  "evidenceBundle": "docs/visual-validation/webgpu-node-gtao/bundle",
  "validationCommand": "node threejs-ambient-contact-shading/examples/webgpu-node-gtao/validate.js",
  "commands": {
    "check": "npm --prefix threejs-ambient-contact-shading/examples/webgpu-node-gtao run check",
    "test": "npm --prefix threejs-ambient-contact-shading/examples/webgpu-node-gtao run validate:unit",
    "mutations": "npm --prefix threejs-ambient-contact-shading/examples/webgpu-node-gtao run test:mutations",
    "capture": "npm --prefix threejs-ambient-contact-shading/examples/webgpu-node-gtao run capture --",
    "validateArtifacts": "npm --prefix threejs-ambient-contact-shading/examples/webgpu-node-gtao run validate:artifacts",
    "validateQuick": "npm --prefix threejs-ambient-contact-shading/examples/webgpu-node-gtao run validate:quick",
    "validateFull": "npm --prefix threejs-ambient-contact-shading/examples/webgpu-node-gtao run validate:full"
  },
  "sourceHash": "sha256:d151b7e9512ba31533653581a04ac7359ab067c8ae0963625f675ecdc4781455",
  "proxyStatus": null
}
